username,date,day,exercise_name,level,primaryMuscles,instructions
PinaG,2024-05-24,Thursday,Hack Squat,beginner,quadriceps,Place the back of your torso against the back pad of the machine and hook your shoulders under the shoulder pads provided. Position your legs in the platform using a shoulder width medium stance with the toes slightly pointed out. Tip: Keep your head up at all times and also maintain the back on the pad at all times. Place your arms on the side handles of the machine and disengage the safety bars (which on most designs is done by moving the side handles from a facing front position to a diagonal position). Now straighten your legs without locking the knees. This will be your starting position. (Note: For the purposes of this discussion we will use the medium stance described above which targets overall development; however you can choose any of the three stances described in the foot positioning section). Begin to slowly lower the unit by bending the knees as you maintain a straight posture with the head up (back on the pad at all times). Continue down until the angle between the upper leg and the calves becomes slightly less than 90-degrees (which is the point in which the upper legs are below parallel to the floor). Inhale as you perform this portion of the movement. Tip: If you performed the exercise correctly the front of the knees should make an imaginary straight line with the toes that is perpendicular to the front. If your knees are past that imaginary line (if they are past your toes) then you are placing undue stress on the knee and the exercise has been performed incorrectly. Begin to raise the unit as you exhale by pushing the floor with mainly with the heel of your foot as you straighten the legs again and go back to the starting position. Repeat for the recommended amount of repetitions.
PinaG,2024-05-24,Thursday,Single-Leg Hop Progression,beginner,quadriceps,Arrange a line of cones in front of you. Assume a relaxed standing position balanced on one leg. Raise the knee of your opposite leg. This will be your starting position. Hop forward jumping and landing with the same leg over the cone. Use a countermovement jump to hop from cone to cone. At the end turn around and go back on the other leg.
PinaG,2024-05-24,Thursday,Star Jump,beginner,quadriceps,Begin in a relaxed stance with your feet shoulder width apart and hold your arms close to the body. To initiate the move squat down halfway and explode back up as high as possible. Fully extend your entire body spreading your legs and arms away from the body. As you land bring your limbs back in and absorb your impact through the legs.
PinaG,2024-05-26,Monday,Clean and Press,intermediate,shoulders,Assume a shoulder-width stance with knees inside the arms. Now while keeping the back flat bend at the knees and hips so that you can grab the bar with the arms fully extended and a pronated grip that is slightly wider than shoulder width. Point the elbows out to sides. The bar should be close to the shins. Position the shoulders over or slightly ahead of the bar. Establish a flat back posture. This will be your starting position. Begin to pull the bar by extending the knees. Move your hips forward and raise the shoulders at the same rate while keeping the angle of the back constant; continue to lift the bar straight up while keeping it close to your body. As the bar passes the knee extend at the ankles knees and hips forcefully similar to a jumping motion. As you do so continue to guide the bar with your hands shrugging your shoulders and using the momentum from your movement to pull the bar as high as possible. The bar should travel close to your body and you should keep your elbows out. At maximum elevation your feet should clear the floor and you should start to pull yourself under the bar. The mechanics of this could change slightly depending on the weight used. You should descend into a squatting position as you pull yourself under the bar. As the bar hits terminal height rotate your elbows around and under the bar. Rack the bar across the front of the shoulders while keeping the torso erect and flexing the hips and knees to absorb the weight of the bar. Stand to full height holding the bar in the clean position. Without moving your feet press the bar overhead as you exhale. Lower the bar under control .
PinaG,2024-05-26,Monday,One-Arm Kettlebell Push Press,intermediate,shoulders,"Hold a kettlebell by the handle. Clean the kettlebell to your shoulder by extending through the legs and hips as you pull the kettlebell towards your shoulder. Rotate your wrist as you do so so that the palm faces forward. This will be your starting position. Dip your body by bending the knees keeping your torso upright. ""Immediately reverse direction driving through the heels in essence jumping to create momentum. As you do so press the kettlebell overhead to lockout by extending the arms using your bodys momentum to move the weight. Lower the weight to perform the next repetition."""
PinaG,2024-05-26,Monday,Two-Arm Kettlebell Military Press,intermediate,shoulders,Clean two kettlebells to your shoulders. Clean the kettlebells to your shoulders by extending through the legs and hips as you swing the kettlebells towards your shoulders. Rotate your wrists as you do so so that the palms face forward. Press the kettlebells up and out. As the kettlebells pass your head lean into the weights so that the kettlebells are racked behind your head. Make sure to contract your lats butt and stomach for added stability.
PinaG,2024-05-26,Monday,Cuban Press,intermediate,shoulders,"Take a dumbbell in each hand with a pronated grip in a standing position. Raise your upper arms so that they are parallel to the floor allowing your lower arms to hang in the ""scarecrow"" position. This will be your starting position. To initiate the movement externally rotate the shoulders to move the upper arm 180 degrees. Keep the upper arms in place rotating the upper arms until the wrists are directly above the elbows the forearms perpendicular to the floor. Now press the dumbbells by extending at the elbows straightening your arms overhead. Return to the starting position as you breathe in by reversing the steps. Repeat for the recommended amount of repetitions."
PinaG,2024-05-26,Monday,Dumbbell One-Arm Upright Row,intermediate,shoulders,Grab a dumbbell and stand up straight with your arm extended in front of you with a slight bend at the elbows and your back straight. This will be your starting position. Tip: The dumbbell should be resting on top of your thigh with the palm of your hands facing your thighs. Keep the other hand can be kept fully extended to the side by the waist or grabbing a fixed surface. This will be your starting position. Use your side shoulders to lift the dumbbell as you exhale. The dumbbell should be close to the body as you move it up. Continue to lift it until the dumbbell is nearly in line with your chin. Tip: Your elbows should drive the motion. As you lift the dumbbell your elbow should always be higher than your forearm. Also keep your torso stationary and pause for a second at the top of the movement. Lower the dumbbell back down slowly to the starting position. Inhale as you perform this portion of the movement. Repeat for the recommended amount of repetitions and switch arms.
PinaG,2024-05-27,Thursday,Suspended Fallout,intermediate,abdominals,Adjust the straps so the handles are at an appropriate height below waist level. Begin standing and grasping the handles. Lean into the straps moving to an incline push-up position. This will be your starting position. Keeping your arms straight lean further into the suspension straps bringing your body closer to the ground allowing your shoulders to extend raising your arms up and over your head. Maintain a neutral spine and keep the rest of your body straight your shoulders being the only joints allowed to move. Pause during the peak contraction and then return to the starting position.
PinaG,2024-05-27,Thursday,Face Pull,intermediate,shoulders,Facing a high pulley with a rope or dual handles attached pull the weight directly towards your face separating your hands as you do so. Keep your upper arms parallel to the ground.
PinaG,2024-05-27,Thursday,Kettlebell Seesaw Press,intermediate,shoulders,Clean two kettlebells two your shoulders. Press one kettlebell. Lower the kettlebell and immediately press the other kettlebell. Make sure to do the same amount of reps on both sides.
PinaG,2024-05-27,Thursday,Kettlebell Turkish Get-Up (Squat style),intermediate,shoulders,Lie on your back on the floor and press a kettlebell to the top position by extending the elbow. Bend the knee on the same side as the kettlebell. Keeping the kettlebell locked out at all times pivot to the opposite side and use your non- working arm to assist you in driving forward to the lunge position. Using your free hand push yourself to a seated position then progressing to your feet. While looking up at the kettlebell slowly stand up. Reverse the motion back to the starting position and repeat.
PinaG,2024-05-27,Thursday,Gorilla Chin/Crunch,intermediate,abdominals,Hang from a chin-up bar using an underhand grip (palms facing you) that is slightly wider than shoulder width. Now bend your knees at a 90 degree angle so that the calves are parallel to the floor while the thighs remain perpendicular to it. This will be your starting position. As you exhale pull yourself up while crunching your knees up at the same time until your knees are at chest level. You will stop going up as soon as your nose is at the same level as the bar. Tip: When you get to this point you should also be finishing the crunch at the same time. Slowly start to inhale as you return to the starting position. Repeat for the recommended amount of repetitions.
PinaG,2024-05-28,Saturday,Weighted Sit-Ups - With Bands,intermediate,abdominals,Start out by strapping the bands around the base of the decline bench. Place the handles towards the inside of the decline bench so that when lying down you can reach for both of them. Position your legs through the decline machine until they are secured. Now reach for the exercise bands with both hands. Use a pronated (palms forward) grip to grasp the handles. Position them near your collar bone and rotate your wrist to a neutral grip (palms facing the torso). Note: Your arms should remain stationary throughout the exercise. This is the starting position. Move your torso upward until your upper body is perpendicular to the floor while exhaling. Hold the contraction for a second and lower your upper body back down to the starting position while inhaling. Repeat for the recommended amount of repetitions.
PinaG,2024-05-28,Saturday,Rack Delivery,intermediate,shoulders,This drill teaches the delivery of the barbell to the rack position on the shoulders. Begin holding a bar in the scarecrow position with the upper arms parallel to the floor and the forearms hanging down. Use a hook grip with your fingers wrapped over your thumbs. Begin by rotating the elbows around the bar delivering the bar to the shoulders. As your elbows come forward relax your grip. The shoulders should be protracted providing a shelf for the bar which should lightly contact the throat. It is important that the bar stay close to the body at all times as with a heavier load any distance will result in an unwanted collision. As the movement becomes smoother speed and load can be increased before progressing further.
PinaG,2024-05-28,Saturday,One-Arm Kettlebell Clean and Jerk,intermediate,shoulders,"Hold a kettlebell by the handle. Clean the kettlebell to your shoulder by extending through the legs and hips as you pull the kettlebell towards your shoulder. Rotate your wrist as you do so so that the palm faces forward. Dip your body by bending the knees keeping your torso upright. ""Immediately reverse direction driving through the heels in essence jumping to create momentum. As you do so press the kettlebell overhead to lockout by extending the arms using your bodys momentum to move the weight."" Receive the weight overhead by returning to a squat position underneath the weight. Keeping the weight overhead return to a standing position. Lower the weight to the floor to perform the next repetition."
PinaG,2024-05-28,Saturday,Lying One-Arm Lateral Raise,intermediate,shoulders,While holding a dumbbell in one hand lay with your chest down on a flat bench. The other hand can be used to hold to the leg of the bench for stability. Position the palm of the hand that is holding the dumbbell in a neutral manner (palms facing your torso) as you keep the arm extended with the elbow slightly bent. This will be your starting position. Now raise the arm with the dumbbell to the side until your elbow is at shoulder height and your arm is roughly parallel to the floor as you exhale. Tip: Maintain your arm perpendicular to the torso while keeping your arm extended throughout the movement. Also keep the contraction at the top for a second. Slowly lower the dumbbell to the starting position as you inhale. Repeat for the recommended amount of repetitions.
PinaG,2024-05-28,Saturday,Lying Rear Delt Raise,intermediate,shoulders,While holding a dumbbell in each hand lay with your chest down on a flat bench. Position the palms of the hands in a neutral manner (palms facing your torso) as you keep the arms extended with the elbows slightly bent. This will be your starting position. Now raise the arms to the side until your elbows are at shoulder height and your arms are roughly parallel to the floor as you exhale. Tip: Maintain your arms perpendicular to the torso while keeping them extended throughout the movement. Also keep the contraction at the top for a second. Slowly lower the dumbbells to the starting position as you inhale. Repeat for the recommended amount of repetitions and then switch to the other arm.
PinaG,2024-05-26,Wednesday,Arm Circles,beginner,shoulders,Stand up and extend your arms straight out by the sides. The arms should be parallel to the floor and perpendicular (90-degree angle) to your torso. This will be your starting position. Slowly start to make circles of about 1 foot in diameter with each outstretched arm. Breathe normally as you perform the movement. Continue the circular motion of the outstretched arms for about ten seconds. Then reverse the movement going the opposite direction.
PinaG,2024-05-26,Wednesday,Cable Rear Delt Fly,beginner,shoulders,Adjust the pulleys to the appropriate height and adjust the weight. The pulleys should be above your head. Grab the left pulley with your right hand and the right pulley with your left hand crossing them in front of you. This will be your starting position. Initiate the movement by moving your arms back and outward keeping your arms straight as you execute the movement. Pause at the end of the motion before returning the handles to the start position.
PinaG,2024-05-26,Wednesday,Alternating Cable Shoulder Press,beginner,shoulders,Move the cables to the bottom of the tower and select an appropriate weight. Grasp the cables and hold them at shoulder height palms facing forward. This will be your starting position. Keeping your head and chest up extend through the elbow to press one side directly over head. After pausing at the top return to the starting position and repeat on the opposite side.
PinaG,2024-05-26,Wednesday,Shoulder Circles,beginner,shoulders,"""With shoulders relaxed and arms resting loosely at your sides (or in your lap if youre seated) gently roll your shoulders forward up back and down."" Reverse direction. You can do this exercise alternating shoulders or both at the same time."
PinaG,2024-05-26,Wednesday,Standing Low-Pulley Deltoid Raise,beginner,shoulders,Start by standing to the right side of a low pulley row. Use your left hand to come across the body and grab a single handle attached to the low pulley with a pronated grip (palms facing down). Rest your arm in front of you. Your right hand should grab the machine for better support and balance. Make sure that your back is erect and your feet are shoulder width apart from each other. This is the starting position. Begin to use the left hand and come across your body out until it is elevated to shoulder height while exhaling. Feel the contraction at the top for a second and begin to slowly lower the handle back down to the original starting position while inhaling. Repeat for the recommended amount of repetitions. Switch arms and repeat the exercise.
PinaG,2024-05-19,Tuesday,Dumbbell Scaption,beginner,shoulders,This corrective exercise strengthens the muscles that stabilize your shoulder blade. Hold a light weight in each hand hanging at your sides. Your thumbs should pointing up. Begin the movement raising your arms out in front of you about 30 degrees off center. Your arms should be fully extended as you perform the movement. Continue until your arms are parallel to the ground and then return to the starting position.
PinaG,2024-05-19,Tuesday,Round The World Shoulder Stretch,beginner,shoulders,"Stand up straight with your legs together holding a bodybar or broomstick. Hold the pole behind your hips with a wider than shoulder width grip. Your palms should be down and your thumbs facing out. ""Slowly lift your arms up behind your head. Dont force it if it gets hard to lift further."""
PinaG,2024-05-19,Tuesday,Moving Claw Series,beginner,hamstrings,This move helps prepare your running form to help you excel at sprinting. As you run be sure to flex the knee aiming to kick your glutes as the hip extends. Reload the quad as the leg moves back forward attacking the ground on the next step. Ensure that as you run you block with the arms punching through in a rapid 1-2 motion.
PinaG,2024-05-19,Tuesday,Kettlebell Pirate Ships,beginner,shoulders,With a wide stance hold a kettlebell with both hands. Allow it to hang at waist level with your arms extended. This will be your starting position. Initiate the movement by turning to one side swinging the kettlebell to head height. Briefly pause at the top of the motion. Allow the bell to drop as you rotate to the opposite side again raising the kettlebell to head height. Repeat for the desired amount of repetitions.
PinaG,2024-05-19,Tuesday,External Rotation with Cable,beginner,shoulders,Adjust the cable to the same height as your elbow. Stand with your left side to the band a couple of feet away. Grasp the handle with your right hand and keep your elbow pressed firmly to your side. We recommend you hold a pad or foam roll in place with your elbow to keep it firmly in position. With your upper arm in position your elbow should be flexed to 90 degrees with your hand reaching across the front of your torso. This will be your starting position. Execute the movement by rotating your arm in a backhand motion keeping your elbow in place.
PinaG,2024-05-20,Thursday,Return Push from Stance,beginner,shoulders,You will need a partner for this drill. Begin in an athletic 2 or 3 point stance. At the signal move into a position to receive the pass from your partner. Catch the medicine ball with both hands and immediately throw it back to your partner. You can modify this drill by running different routes.
PinaG,2024-05-20,Thursday,Elbow Circles,beginner,shoulders,Sit or stand with your feet slightly apart. Place your hands on your shoulders with your elbows at shoulder level and pointing out. Slowly make a circle with your elbows. Breathe out as you start the circle and breathe in as you complete the circle.
PinaG,2024-05-20,Thursday,Shoulder Press - With Bands,beginner,shoulders,"""To begin stand on an exercise band so that tension begins at arms length. Grasp the handles and lift them so that the hands are at shoulder height at each side."" Rotate the wrists so that the palms of your hands are facing forward. Your elbows should be bent with the upper arms and forearms in line to the torso. This is your starting position. As you exhale lift the handles up until your arms are fully extended overhead."
PinaG,2024-05-20,Thursday,Standing Palm-In One-Arm Dumbbell Press,beginner,shoulders,Start by having a dumbbell in one hand with your arm fully extended to the side using a neutral grip. Use your other arm to hold on to an incline bench to keep your balance. Your feet should be shoulder width apart from each other. Now slowly lift the dumbbell up until you create a 90 degree angle with your arm. Note: Your forearm should be perpendicular to the floor. Continue to maintain a neutral grip throughout the entire exercise. Slowly lift the dumbbell up until your arm is fully extended. This the starting position. While inhaling lower the weight down until your arm is at a 90 degree angle again. Feel the contraction for a second and then lift the weight back up towards the starting position while exhaling. Remember to hold on to the incline bench and keep your feet positioned to keep balance during the exercise. Repeat for the recommended amount of repetitions. Switch arms and repeat the exercise.
PinaG,2024-05-20,Thursday,Smith Incline Shoulder Raise,beginner,shoulders,Place an incline bench underneath the smith machine. Place the barbell at a height that you can reach when lying down and your arms are almost fully extended. Once the weight you need is selected lie down on the incline bench and make sure your shoulders are aligned right under the barbell. Using a shoulder width pronated (palms forward) grip lift the bar from the rack and hold it straight over you with a slight bend at the elbows. This will be your starting position. As you breathe out lift the bar up until your arms are fully extended. Note: The contraction should be felt around the shoulders. After a second pause bring the bar back down to the starting position as you breathe in. Repeat the movement for the prescribed amount of repetitions. When you are done place the bar back in the rack.
PinaG,2024-05-21,Saturday,Back Flyes - With Bands,beginner,shoulders,Run a band around a stationary post like that of a squat rack. Grab the band by the handles and stand back so that the tension in the band rises. Extend and lift the arms straight in front of you. Tip: Your arms should be straight and parallel to the floor while perpendicular to your torso. Your feet should be firmly planted on the floor spread at shoulder width. This will be your starting position. As you exhale move your arms to the sides and back. Keep your arms extended and parallel to the floor. Continue the movement until the arms are extended to your sides. After a pause go back to the original position as you inhale. Repeat for the recommended amount of repetitions.
PinaG,2024-05-21,Saturday,Prone Manual Hamstring,beginner,hamstrings,You will need a partner for this exercise. Lay face down with your legs straight. Your assistant will place their hand on your heel. To begin flex the knee to curl your leg up. Your partner should provide resistance starting light and increasing the pressure as the movement is completed. Communicate with your partner to monitor appropriate resistance levels. Pause at the top returning the leg to the starting position as your partner provides resistance going the other direction.
PinaG,2024-05-21,Saturday,Standing Toe Touches,beginner,hamstrings,Stand with some space in front and behind you. Bend at the waist keeping your legs straight until you can relax and let your upper body hang down in front of you. Let your arms and hands hang down naturally. Hold for 10 to 20 seconds.
PinaG,2024-05-21,Saturday,Seated Leg Curl,beginner,hamstrings,Adjust the machine lever to fit your height and sit on the machine with your back against the back support pad. Place the back of lower leg on top of padded lever (just a few inches under the calves) and secure the lap pad against your thighs just above the knees. Then grasp the side handles on the machine as you point your toes straight (or you can also use any of the other two stances) and ensure that the legs are fully straight right in front of you. This will be your starting position. As you exhale pull the machine lever as far as possible to the back of your thighs by flexing at the knees. Keep your torso stationary at all times. Hold the contracted position for a second. Slowly return to the starting position as you breathe in. Repeat for the recommended amount of repetitions.
PinaG,2024-05-21,Saturday,Return Push from Stance,beginner,shoulders,You will need a partner for this drill. Begin in an athletic 2 or 3 point stance. At the signal move into a position to receive the pass from your partner. Catch the medicine ball with both hands and immediately throw it back to your partner. You can modify this drill by running different routes.
Nadine,2024-05-14,Friday,Cable Shoulder Press,beginner,shoulders,Move the cables to the bottom of the towers and select an appropriate weight. Stand directly in between the uprights. Grasp the cables and hold them at shoulder height palms facing forward. This will be your starting position. Keeping your head and chest up extend through the elbow to press the handles directly over head. After pausing at the top return to the starting position and repeat.
Nadine,2024-05-14,Friday,Seated Cable Shoulder Press,beginner,shoulders,Adjust the weight to an appropriate amount and be seated grasping the handles. Your upper arms should be about 90 degrees to the body with your head and chest up. The elbows should also be bent to about 90 degrees. This will be your starting position. Begin by extending through the elbow pressing the handles together above your head. After pausing at the top return the handles to the starting position. Ensure that you maintain tension on the cables. You can also execute this movement with your back off the pad and alternate hands.
