username,date,day,exercise_name,level,primaryMuscles,instructions
Nadine,2024-05-23,Saturday,Incline Dumbbell Bench With Palms Facing In,beginner,chest,Lie back on an incline bench with a dumbbell on each hand on top of your thighs. The palms of your hand will be facing each other. By using your thighs to help you get the dumbbells up clean the dumbbells one arm at a time so that you can hold them at shoulder width. Once at shoulder width keep the palms of your hands with a neutral grip (palms facing each other). Keep your elbows flared out with the upper arms in line with the shoulders (perpendicular to the torso) and the elbows bent creating a 90-degree angle between the upper arm and the forearm. This will be your starting position. Now bring down the weights slowly to your side as you breathe in. Keep full control of the dumbbells at all times. As you breathe out push the dumbbells up using your pectoral muscles. Lock your arms in the contracted position hold for a second and then start coming down slowly. Tip: It should take at least twice as long to go down than to come up. Repeat the movement for the prescribed amount of repetitions. When you are done place the dumbbells back in your thighs and then on the floor. This is the safest manner to dispose of the dumbbells.
Nadine,2024-05-26,Monday,Barbell Rear Delt Row,beginner,shoulders,"Stand up straight while holding a barbell using a wide (higher than shoulder width) and overhand (palms facing your body) grip. Bend knees slightly and bend over as you keep the natural arch of your back. Let the arms hang in front of you as they hold the bar. Once your torso is parallel to the floor flare the elbows out and away from your body. Tip: Your torso and your arms should resemble the letter ""T"". Now you are ready to begin the exercise. While keeping the upper arms perpendicular to the torso pull the barbell up towards your upper chest as you squeeze the rear delts and you breathe out. Tip: When performed correctly this exercise should resemble a bench press in reverse. Also refrain from using your biceps to do the work. Focus on targeting the rear delts; the arms should only act as hooks. Slowly go back to the initial position as you breathe in. Repeat for the recommended amount of repetitions."
Nadine,2024-05-26,Monday,Alternating Deltoid Raise,beginner,shoulders,In a standing position hold a pair of dumbbells at your side. Keeping your elbows slightly bent raise the weights directly in front of you to shoulder height avoiding any swinging or cheating. Return the weights to your side. On the next repetition raise the weights laterally raising them out to your side to about shoulder height. Return the weights to the starting position and continue alternating to the front and side.
Nadine,2024-05-26,Monday,Lateral Raise - With Bands,beginner,shoulders,"""To begin stand on an exercise band so that tension begins at arms length. Grasp the handles using a pronated (palms facing your thighs) grip that is slightly less than shoulder width. The handles should be resting on the sides of your thighs. Your arms should be extended with a slight bend at the elbows and your back should be straight. This will be your starting position."" Use your side shoulders to lift the handles to the sides as you exhale. Continue to lift the handles until they are slightly above parallel. Tip: As you lift the handles slightly tilt the hand as if you were pouring water and keep your arms extended. Also keep your torso stationary and pause for a second at the top of the movement. Lower the handles back down slowly to the starting position. Inhale as you perform this portion of the movement. Repeat for the recommended amount of repetitions."
Nadine,2024-05-26,Monday,Side Laterals to Front Raise,beginner,shoulders,In a standing position hold a pair of dumbbells at your side. This will be your starting position. Keeping your elbows slightly bent raise the weights directly in front of you to shoulder height avoiding any swinging or cheating. At the top of the exercise move the weights out in front of you keeping your arms extended. Lower the weights with a controlled motion. On the next repetition raise the weights in front of you to shoulder height before moving the weights laterally to your sides. Lower the weights to the starting position.
Nadine,2024-05-26,Monday,Upright Barbell Row,beginner,shoulders,Grasp a barbell with an overhand grip that is slightly less than shoulder width. The bar should be resting on the top of your thighs with your arms extended and a slight bend in your elbows. Your back should also be straight. This will be your starting position. Now exhale and use the sides of your shoulders to lift the bar raising your elbows up and to the side. Keep the bar close to your body as you raise it. Continue to lift the bar until it nearly touches your chin. Tip: Your elbows should drive the motion and should always be higher than your forearms. Remember to keep your torso stationary and pause for a second at the top of the movement. Lower the bar back down slowly to the starting position. Inhale as you perform this portion of the movement. Repeat for the recommended amount of repetitions.
Nadine,2024-05-27,Friday,Standing Two-Arm Overhead Throw,beginner,shoulders,Stand with your feet shoulder width apart holding a medicine ball in both hands. To begin reach the medicine ball deep behind your head as you bend the knees slightly and lean back. Violently throw the ball forward flexing at the hip and using your whole body to complete the movement. The medicine ball can be thrown to a partner or to a wall receiving it as it bounces back.
Nadine,2024-05-27,Friday,Chair Upper Body Stretch,beginner,shoulders,Sit on the edge of a chair gripping the back of it. Straighten your arms keeping your back straight and pull your upper body forward so you feel a stretch. Hold for 20-30 seconds.
Nadine,2024-05-27,Friday,Elbow Circles,beginner,shoulders,Sit or stand with your feet slightly apart. Place your hands on your shoulders with your elbows at shoulder level and pointing out. Slowly make a circle with your elbows. Breathe out as you start the circle and breathe in as you complete the circle.
Nadine,2024-05-27,Friday,Dumbbell Raise,beginner,shoulders,Grab a dumbbell in each arm and stand up straight with your arms extended by your sides with a slight bend at the elbows and your back straight. This will be your starting position. Tip: The dumbbell should be next to your thighs with the palm of your hands facing back. Use your side shoulders to lift the dumbbells as you exhale. The dumbbells should be to the side of the body as you move them up. Continue to lift it until the dumbbells are nearly in line with your chin. Tip: Your elbows should drive the motion. As you lift the dumbbell your elbow should always be higher than your forearm. Also keep your torso stationary and pause for a second at the top of the movement. Lower the dumbbells back down slowly to the starting position. Inhale as you perform this portion of the movement. Repeat for the recommended amount of repetitions.
Nadine,2024-05-27,Friday,Band Pull Apart,beginner,shoulders,Begin with your arms extended straight out in front of you holding the band with both hands. Initiate the movement by performing a reverse fly motion moving your hands out laterally to your sides. Keep your elbows extended as you perform the movement bringing the band to your chest. Ensure that you keep your shoulders back during the exercise. Pause as you complete the movement returning to the starting position under control.
Nadine,2024-06-16,Sunday,Barbell Glute Bridge,intermediate,glutes,Begin seated on the ground with a loaded barbell over your legs. Using a fat bar or having a pad on the bar can greatly reduce the discomfort caused by this exercise. Roll the bar so that it is directly above your hips and lay down flat on the floor. Begin the movement by driving through with your heels extending your hips vertically through the bar. Your weight should be supported by your upper back and the heels of your feet. Extend as far as possible then reverse the motion to return to the starting position.
Nadine,2024-06-16,Sunday,Kneeling Squat,intermediate,glutes,Set the bar to the proper height in a power rack. Kneel behind the bar; it may be beneficial to put a mat down to pad your knees. Slide under the bar racking it across the back of your shoulders. Your shoulder blades should be retracted and the bar tight across your back. Unrack the weight. With your head looking forward sit back with your butt until you touch your calves. Reverse the motion returning the torso to an upright position.
Nadine,2024-06-16,Sunday,Downward Facing Balance,intermediate,glutes,Lie facedown on top of an exercise ball. While resting on your stomach on the ball walk your hands forward along the floor and lift your legs extending your elbows and knees.
Nadine,2024-06-16,Sunday,Piriformis-SMR,intermediate,glutes,Sit with your buttocks on top of a foam roll. Bend your knees and then cross one leg so that the ankle is over the knee. This will be your starting position. Shift your weight to the side of the crossed leg rolling over the buttocks until you feel tension in your upper glute. You may assist the stretch by using one hand to pull the bent knee towards your chest. Hold this position for 10-30 seconds and then switch sides.
Nadine,2024-06-16,Sunday,Barbell Hip Thrust,intermediate,glutes,Begin seated on the ground with a bench directly behind you. Have a loaded barbell over your legs. Using a fat bar or having a pad on the bar can greatly reduce the discomfort caused by this exercise. Roll the bar so that it is directly above your hips and lean back against the bench so that your shoulder blades are near the top of it. Begin the movement by driving through your feet extending your hips vertically through the bar. Your weight should be supported by your shoulder blades and your feet. Extend as far as possible then reverse the motion to return to the starting position.
Nadine,2024-06-09,Wednesday,Standing Dumbbell Reverse Curl,intermediate,biceps,To begin stand straight with a dumbbell in each hand using a pronated grip (palms facing down). Your arms should be fully extended while your feet are shoulder width apart from each other. This is the starting position. While holding the upper arms stationary curl the weights while contracting the biceps as you breathe out. Only the forearms should move. Continue the movement until your biceps are fully contracted and the dumbbells are at shoulder level. Hold the contracted position for a second as you squeeze the muscle. Slowly begin to bring the dumbbells back to starting position as your breathe in. Repeat for the recommended amount of repetitions.
Nadine,2024-06-09,Wednesday,Weighted Ball Hyperextension,intermediate,lower back,To begin lie down on an exercise ball with your torso pressing against the ball and parallel to the floor. The ball of your feet should be pressed against the floor to help keep you balanced. Place a weighted plate under your chin or behind your neck. This is the starting position. Slowly raise your torso up by bending at the waist and lower back. Remember to exhale during this movement. Hold the contraction on your lower back for a second and lower your torso back down to the starting position while inhaling. Repeat for the recommended amount of repetitions prescribed in your program.
Nadine,2024-06-09,Wednesday,Keg Load,intermediate,lower back,To load kegs place the desired number a distance from the loading platform typically 30-50 feet. Begin by grabbing the close handle of the first keg tilting it onto its side to grab the opposite edge of the bottom of the keg. Lift the keg up to your chest. The higher you can place the keg the faster you should be able to move to the platform. Shouldering is usually not allowed. Be sure to keep a firm hold on the keg. Move as quickly as possible to the platform and load it extending through your hips knees and ankles to get it as high as possible. Return to the starting position to retrieve the next keg and repeat until the event is completed.
Nadine,2024-06-09,Wednesday,Crossover Reverse Lunge,intermediate,lower back,Stand with your feet shoulder width apart. This will be your starting position. Perform a rear lunge by stepping back with one foot and flexing the hips and front knee. As you do so rotate your torso across the front leg. After a brief pause return to the starting position and repeat on the other side continuing in an alternating fashion.
Nadine,2024-06-09,Wednesday,Standing Inner-Biceps Curl,intermediate,biceps,"""Stand up with a dumbbell in each hand being held at arms length. The elbows should be close to the torso. Your legs should be at about shoulders width apart from each other."" Rotate the palms of the hands so that they are facing inward in a neutral position. This will be your starting position. While holding the upper arms stationary curl the weights out while contracting the biceps as you breathe out. Your wrist should turn so that when the weights are fully elevated you have supinated grip (palms facing up). Only the forearms should move. Continue the movement until your biceps are fully contracted and the dumbbells are at shoulder level. Tip: Keep the forearms aligned with your outer deltoids. Hold the contracted position for a second as you squeeze the biceps. Slowly begin to bring the dumbbells back to the starting position as your breathe in. Remember to rotate the wrists as you lower the weight in order to switch back to a neutral grip. Repeat for the recommended amount of repetitions."
Nadine,2024-06-10,Friday,Pelvic Tilt Into Bridge,intermediate,lower back,"Lie down with your feet on the floor heels directly under your knees. ""Lift only your tailbone to the ceiling to stretch your lower back. (Dont lift the entire spine yet.) Pull in your stomach."" To go into a bridge lift the entire spine except the neck."
Nadine,2024-06-10,Friday,Standing One-Arm Cable Curl,intermediate,biceps,Start out by grabbing single handle next to the low pulley machine. Make sure you are far enough from the machine so that your arm is supporting the weight. Make sure that your upper arm is stationary perpendicular to the floor with elbows in and palms facing forward. Your non lifting arm should be grabbing your waist. This will allow you to keep your balance. Slowly begin to curl the single handle upwards while keeping the upper arm stationary until your forearm touches your bicep while exhaling. Tip: Only the forearm should move. Hold the contraction position as you squeeze the bicep and then lower the single handle back down to the starting position as you inhale. Repeat for the recommended amount of repetitions. Switch arms while performing this exercise.
Nadine,2024-06-10,Friday,Standing Inner-Biceps Curl,intermediate,biceps,"""Stand up with a dumbbell in each hand being held at arms length. The elbows should be close to the torso. Your legs should be at about shoulders width apart from each other."" Rotate the palms of the hands so that they are facing inward in a neutral position. This will be your starting position. While holding the upper arms stationary curl the weights out while contracting the biceps as you breathe out. Your wrist should turn so that when the weights are fully elevated you have supinated grip (palms facing up). Only the forearms should move. Continue the movement until your biceps are fully contracted and the dumbbells are at shoulder level. Tip: Keep the forearms aligned with your outer deltoids. Hold the contracted position for a second as you squeeze the biceps. Slowly begin to bring the dumbbells back to the starting position as your breathe in. Remember to rotate the wrists as you lower the weight in order to switch back to a neutral grip. Repeat for the recommended amount of repetitions."
Nadine,2024-06-10,Friday,Axle Deadlift,intermediate,lower back,Approach the bar so that it is centered over your feet. You feet should be about hip width apart. Bend at the hip to grip the bar at shoulder width allowing your shoulder blades to protract. Typically you would use an over/under grip. With your feet and your grip set take a big breath and then lower your hips and flex the knees until your shins contact the bar. Look forward with your head keep your chest up and your back arched and begin driving through the heels to move the weight upward. After the bar passes the knees aggressively pull the bar back pulling your shoulder blades together as you drive your hips forward into the bar. Lower the bar by bending at the hips and guiding it to the floor.
Nadine,2024-06-10,Friday,Keg Load,intermediate,lower back,To load kegs place the desired number a distance from the loading platform typically 30-50 feet. Begin by grabbing the close handle of the first keg tilting it onto its side to grab the opposite edge of the bottom of the keg. Lift the keg up to your chest. The higher you can place the keg the faster you should be able to move to the platform. Shouldering is usually not allowed. Be sure to keep a firm hold on the keg. Move as quickly as possible to the platform and load it extending through your hips knees and ankles to get it as high as possible. Return to the starting position to retrieve the next keg and repeat until the event is completed.
nadine,2024-05-26,Monday,Straight Raises on Incline Bench,beginner,shoulders,Place a bar on the ground behind the head of an incline bench. Lay on the bench face down. With a pronated grip pick the barbell up from the floor keeping your arms straight. Allow the bar to hang straight down. This will be your starting position. To begin raise the barbell out in front of your head while keeping your arms extended. Return to the starting position.
nadine,2024-05-26,Monday,Front Cable Raise,beginner,shoulders,"Select the weight on a low pulley machine and grasp the single hand cable attachment that is attached to the low pulley with your left hand. ""Face away from the pulley and put your arm straight down with the hand cable attachment in front of your thighs at arms length with the palms of the hand facing your thighs. This will be your starting position."" While maintaining the torso stationary (no swinging) lift the left arm to the front with a slight bend on the elbow and the palms of the hand always faces down. Continue to go up until you arm is slightly above parallel to the floor. Exhale as you execute this portion of the movement and pause for a second at the top. Now as you inhale lower the arm back down slowly to the starting position. Once all of the recommended amount of repetitions have been performed for this arm switch arms and perform the exercise with the right one."
nadine,2024-05-26,Monday,One-Arm Incline Lateral Raise,beginner,shoulders,Lie down sideways on an incline bench press with a dumbbell in the hand. Make sure the shoulder is pressing against the incline bench and the arm is lying across your body with the palm around your navel. Hold a dumbbell in your uppermost arm while keeping it extended in front of you parallel to the floor. This is your starting position. While keeping the dumbbell parallel to the floor at all times perform a lateral raise. Your arm should travel straight up until it is pointing at the ceiling. Tip: Exhale as you perform this movement. Hold the dumbbell in the position and feel the contraction in the shoulders for a second. While inhaling lower the weight across your body back into the starting position. Repeat the movement for the prescribed amount of repetitions. Switch arms and repeat the movement.
nadine,2024-05-26,Monday,Cable Seated Lateral Raise,beginner,shoulders,Stand in the middle of two low pulleys that are opposite to each other and place a flat bench right behind you (in perpendicular fashion to you; the narrow edge of the bench should be the one behind you). Select the weight to be used on each pulley. Now sit at the edge of the flat bench behind you with your feet placed in front of your knees. Bend forward while keeping your back flat and rest your torso on the thighs. Have someone give you the single handles attached to the pulleys. Grasp the left pulley with the right hand and the right pulley with the left after you select your weight. The pulleys should run under your knees and your arms will be extended with palms facing each other and a slight bend at the elbows. This will be the starting position. While keeping the arms stationary raise the upper arms to the sides until they are parallel to the floor and at shoulder height. Exhale during the execution of this movement and hold the contraction for a second. Slowly lower your arms to the starting position as you inhale. Repeat for the recommended amount of repetitions. Tip: Maintain upper arms perpendicular to torso and a fixed elbow position (10 degree to 30 degree angle) throughout exercise.
nadine,2024-05-26,Monday,Low Pulley Row To Neck,beginner,shoulders,Sit on a low pulley row machine with a rope attachment. Grab the ends of the rope using a palms-down grip and sit with your back straight and your knees slightly bent. Tip: Keep your back almost completely vertical and your arms fully extended in front of you. This will be your starting position. While keeping your torso stationary lift your elbows and start bending them as you pull the rope towards your neck while exhaling. Throughout the movement your upper arms should remain parallel to the floor. Tip: Continue this motion until your hands are almost next to your ears (the forearms will not be parallel to the floor at the end of the movement as they will be angled a bit upwards) and your elbows are out away from your sides. After holding for a second or so at the contracted position come back slowly to the starting position as you inhale. Tip: Again during no part of the movement should the torso move. Repeat for the recommended amount of repetitions.
nadine,2024-05-27,Wednesday,Glute Kickback,beginner,glutes,Kneel on the floor or an exercise mat and bend at the waist with your arms extended in front of you (perpendicular to the torso) in order to get into a kneeling push-up position but with the arms spaced at shoulder width. Your head should be looking forward and the bend of the knees should create a 90-degree angle between the hamstrings and the calves. This will be your starting position. As you exhale lift up your right leg until the hamstrings are in line with the back while maintaining the 90-degree angle bend. Contract the glutes throughout this movement and hold the contraction at the top for a second. Tip: At the end of the movement the upper leg should be parallel to the floor while the calf should be perpendicular to it. Go back to the initial position as you inhale and now repeat with the left leg. Continue to alternate legs until all of the recommended repetitions have been performed.
nadine,2024-05-27,Wednesday,Standing Pelvic Tilt,beginner,lower back,Start off with your feet hip-distance apart. Bend your knees slightly to keep them soft and springy. You may want to move your pelvis forward and backward and back few times before holding the tailbone forward in this stretch.
nadine,2024-05-27,Wednesday,Band Pull Apart,beginner,shoulders,Begin with your arms extended straight out in front of you holding the band with both hands. Initiate the movement by performing a reverse fly motion moving your hands out laterally to your sides. Keep your elbows extended as you perform the movement bringing the band to your chest. Ensure that you keep your shoulders back during the exercise. Pause as you complete the movement returning to the starting position under control.
nadine,2024-05-27,Wednesday,Elbow Circles,beginner,shoulders,Sit or stand with your feet slightly apart. Place your hands on your shoulders with your elbows at shoulder level and pointing out. Slowly make a circle with your elbows. Breathe out as you start the circle and breathe in as you complete the circle.
nadine,2024-05-27,Wednesday,Bent Over Low-Pulley Side Lateral,beginner,shoulders,Select a weight and hold the handle of the low pulley with your right hand. Bend at the waist until your torso is nearly parallel to the floor. Your legs should be slightly bent with your left hand placed on your lower left thigh. Your right arm should be hanging from your shoulder in front of you and with a slight bend at the elbow. This will be your starting position. Raise your right arm elbow slightly bent to the side until the arm is parallel to the floor and in line with your right ear. Breathe out as you perform this step. Slowly lower the weight back to the starting position as you breathe in. Repeat for the recommended amount of repetitions and repeat the movement with the other arm.
Nadine,2024-05-26,Monday,One Knee To Chest,beginner,glutes,Start off by lying on the floor. Extend one leg straight and pull the other knee to your chest. Hold under the knee joint to protect the kneecap. Gently tug that knee toward your nose. Switch sides. This stretches the buttocks and lower back of the bent leg and the hip flexor of the straight leg.
Nadine,2024-05-26,Monday,Step-up with Knee Raise,beginner,glutes,Stand facing a box or bench of an appropriate height with your feet together. This will be your starting position. Begin the movement by stepping up putting your left foot on the top of the bench. Extend through the hip and knee of your front leg to stand up on the box. As you stand on the box with your left leg flex your right knee and hip bringing your knee as high as you can. Reverse this motion to step down off the box and then repeat the sequence on the opposite leg.
