username,date,day,exercise_name,level,primaryMuscles,instructions
PinaG,2024-06-09,Friday,Medicine Ball Chest Pass,beginner,chest,You will need a partner for this exercise. Lacking one this movement can be performed against a wall. Begin facing your partner holding the medicine ball at your torso with both hands. Pull the ball to your chest and reverse the motion by extending through the elbows. For sports applications you can take a step as you throw. Your partner should catch the ball and throw it back to you. Receive the throw with both hands at chest height.
PinaG,2024-06-09,Friday,Push-Up Wide,beginner,chest,With your hands wide apart support your body on your toes and hands in a plank position. Your elbows should be extended and your body straight. Do not allow your hips to sag. This will be your starting position. To begin allow the elbows to flex lowering your chest to the floor as you inhale. Using your pectoral muscles press your upper body back up to the starting position by extending the elbows. Exhale as you perform this step. After pausing at the contracted position repeat the movement for the prescribed amount of repetitions.
PinaG,2024-06-09,Friday,Dumbbell Bench Press,beginner,chest,Lie down on a flat bench with a dumbbell in each hand resting on top of your thighs. The palms of your hands will be facing each other. Then using your thighs to help raise the dumbbells up lift the dumbbells one at a time so that you can hold them in front of you at shoulder width. Once at shoulder width rotate your wrists forward so that the palms of your hands are facing away from you. The dumbbells should be just to the sides of your chest with your upper arm and forearm creating a 90 degree angle. Be sure to maintain full control of the dumbbells at all times. This will be your starting position. Then as you breathe out use your chest to push the dumbbells up. Lock your arms at the top of the lift and squeeze your chest hold for a second and then begin coming down slowly. Tip: Ideally lowering the weight should take about twice as long as raising it. Repeat the movement for the prescribed amount of repetitions of your training program.
PinaG,2024-06-09,Friday,One Arm Dumbbell Bench Press,beginner,chest,Lie down on a flat bench with a dumbbell in one hand on top of your thigh. By using your thigh to help you get the dumbbell up clean the dumbbell up so that you can hold it in front of you at shoulder width. Use the hand you are not lifting with to help position the dumbbell over you properly. Once at shoulder width rotate your wrist forward so that the palm of your hand is facing away from you. This will be your starting position. Bring down the weights slowly to your side as you breathe in. Keep full control of the dumbbell at all times. Tip: Use the hand that you are not lifting with to help keep the dumbbell balance as you may struggle a bit at first. Only use your non-lifting hand if it is needed. Otherwise keep it resting to the side. As you breathe out push the dumbbells up using your pectoral muscles. Lock your arms in the contracted position squeeze your chest hold for a second and then start coming down slowly. Tip: It should take at least twice as long to go down than to come up. Repeat the movement for the prescribed amount of repetitions of your training program. Switch arms and repeat the movement.
PinaG,2024-06-09,Friday,Decline Smith Press,beginner,chest,Place a decline bench underneath the Smith machine. Now place the barbell at a height that you can reach when lying down and your arms are almost fully extended. Using a pronated grip that is wider than shoulder width unlock the bar from the rack and hold it straight over you with your arms extended. This will be your starting position. As you inhale lower the bar under control by allowing the elbows to flex lightly contacting the torso. After a brief pause bring the bar back to the starting position by extending the elbows exhaling as you do so. Repeat the movement for the prescribed amount of repetitions. When the set is complete lock the bar back in the rack.
