username,date,day,exercise_name,level,primaryMuscles,instructions
PinaG,2024-05-28,Saturday,Step-up with Knee Raise,beginner,glutes,Stand facing a box or bench of an appropriate height with your feet together. This will be your starting position. Begin the movement by stepping up putting your left foot on the top of the bench. Extend through the hip and knee of your front leg to stand up on the box. As you stand on the box with your left leg flex your right knee and hip bringing your knee as high as you can. Reverse this motion to step down off the box and then repeat the sequence on the opposite leg.
PinaG,2024-05-28,Saturday,Hip Lift with Band,beginner,glutes,"""After choosing a suitable band lay down in the middle of the rack after securing the band on either side of you. If your rack doesnt have pegs the band can be secured using heavy dumbbells or similar objects just ensure they wont move."" Adjust your position so that the band is directly over your hips. Bend your knees and place your feet flat on the floor. Your hands can be on the floor or holding the band in position. Keeping your shoulders on the ground drive through your heels to raise your hips pushing into the band as high as you can. Pause at the top of the motion and return to the starting position."
PinaG,2024-05-28,Saturday,Hip Extension with Bands,beginner,glutes,Secure one end of the band to the lower portion of a post and attach the other to one ankle. Facing the attachment point of the band hold on to the column to stabilize yourself. Keeping your head and your chest up move the resisted leg back as far as you can while keeping the knee straight. Return the leg to the starting position.
PinaG,2024-05-28,Saturday,Leg Lift,beginner,glutes,While standing up straight with both feet next to each other at around shoulder width grab a sturdy surface such as the sides of a squat rack or the top of a chair to brace yourself and keep balance. With or without an ankle weight lift one leg behind you as if performing a leg curl but standing up while keeping the other leg straight. Breathe out as you perform this movement. Slowly bring the raised leg back to the floor as you breathe in. Repeat for the recommended amount of repetitions. Repeat the movement with the opposite leg.
PinaG,2024-05-28,Saturday,Pull Through,beginner,glutes,Begin standing a few feet in front of a low pulley with a rope or handle attached. Face away from the machine straddling the cable with your feet set wide apart. Begin the movement by reaching through your legs as far as possible bending at the hips. Keep your knees slightly bent. Keeping your arms straight extend through the hip to stand straight up. Avoid pulling upward through the shoulders; all of the motion should originate through the hips.
