username,date,day,exercise_name,level,primaryMuscles,instructions
PinaG,2024-05-16,Saturday,Standing Dumbbell Press,beginner,shoulders,Standing with your feet shoulder width apart take a dumbbell in each hand. Raise the dumbbells to head height the elbows out and about 90 degrees. This will be your starting position. Maintaining strict technique with no leg drive or leaning back extend through the elbow to raise the weights together directly above your head. Pause and slowly return the weight to the starting position.
PinaG,2024-05-16,Saturday,Internal Rotation with Band,beginner,shoulders,Choke the band around a post. The band should be at the same height as your elbow. Stand with your right side to the band a couple of feet away. Grasp the end of the band with your right hand and keep your elbow pressed firmly to your side. We recommend you hold a pad or foam roll in place with your elbow to keep it firmly in position. With your upper arm in position your elbow should be flexed to 90 degrees with your hand reaching away from your torso. This will be your starting position. Execute the movement by rotating your arm in a forehand motion keeping your elbow in place. Continue as far as you are able pause and then return to the starting position.
PinaG,2024-05-16,Saturday,Side Wrist Pull,beginner,shoulders,"This stretch works best standing. Cross your left arm over the midline of your body and hold the left wrist in your right hand down at the level of your hips. Start the stretch with a bent left arm. ""Slowly straighten pull and lift it up to shoulder height as pictured. Feel this stretch originate in your back not your shoulders and dont pull too hard on the shoulders joint. Switch sides."""
PinaG,2024-05-16,Saturday,Cable Shoulder Press,beginner,shoulders,Move the cables to the bottom of the towers and select an appropriate weight. Stand directly in between the uprights. Grasp the cables and hold them at shoulder height palms facing forward. This will be your starting position. Keeping your head and chest up extend through the elbow to press the handles directly over head. After pausing at the top return to the starting position and repeat.
PinaG,2024-05-16,Saturday,Standing Low-Pulley Deltoid Raise,beginner,shoulders,Start by standing to the right side of a low pulley row. Use your left hand to come across the body and grab a single handle attached to the low pulley with a pronated grip (palms facing down). Rest your arm in front of you. Your right hand should grab the machine for better support and balance. Make sure that your back is erect and your feet are shoulder width apart from each other. This is the starting position. Begin to use the left hand and come across your body out until it is elevated to shoulder height while exhaling. Feel the contraction at the top for a second and begin to slowly lower the handle back down to the original starting position while inhaling. Repeat for the recommended amount of repetitions. Switch arms and repeat the exercise.
