username,date,day,exercise_name,level,primaryMuscles,instructions
Maximus,2024-05-01,Saturday,Front Box Jump,beginner,hamstrings,Begin with a box of an appropriate height 1-2 feet in front of you. Stand with your feet should width apart. This will be your starting position. Perform a short squat in preparation for jumping swinging your arms behind you. Rebound out of this position extending through the hips knees and ankles to jump as high as possible. Swing your arms forward and up. Land on the box with the knees bent absorbing the impact through the legs. You can jump from the box back to the ground or preferably step down one leg at a time.
Maximus,2024-05-01,Saturday,Hamstring-SMR,beginner,hamstrings,In a seated position extend your legs over a foam roll so that it is position on the back of the upper legs. Place your hands to the side or behind you to help support your weight. This will be your starting position. Using your hands lift your hips off of the floor and shift your weight on the foam roll to one leg. Relax the hamstrings of the leg you are stretching. Roll over the foam from below the hip to above the back of the knee pausing at points of tension for 10-30 seconds. Repeat for the other leg.
Maximus,2024-05-01,Saturday,Smith Machine Stiff-Legged Deadlift,beginner,hamstrings,To begin set the bar on the smith machine to a height that is around the middle of your thighs. Once the correct height is chosen and the bar is loaded grasp the bar using a pronated (palms forward) grip that is shoulder width apart. You may need some wrist wraps if using a significant amount of weight. Lift the bar up by fully extending your arms while keeping your back straight. Stand with your torso straight and your legs spaced using a shoulder width or narrower stance. The knees should be slightly bent. This is your starting position. Keeping the knees stationary lower the barbell to over the top of your feet by bending at the waist while keeping your back straight. Keep moving forward as if you were going to pick something from the floor until you feel a stretch on the hamstrings. Exhale as you perform this movement Start bringing your torso up straight again as soon as you feel the hamstrings stretch by extending your hips and waist until you are back at the starting position. Inhale as you perform this movement. Repeat for the recommended amount of repetitions.
Maximus,2024-05-01,Saturday,Chair Leg Extended Stretch,beginner,hamstrings,Sit upright in a chair and grip the seat on the sides. Raise one leg extending the knee flexing the ankle as you do so. Slowly move that leg outward as far as you can and then back to the center and down. Repeat for your other leg.
Maximus,2024-05-01,Saturday,Leg-Up Hamstring Stretch,beginner,hamstrings,"Lie flat on your back bend one knee and put that foot flat on the floor to stabilize your spine. ""Extend the other leg in the air. If youre tight you wont be able to straighten it. Thats okay. Extend the knee so that the sole of the lifted foot faces the ceiling (or as close as you can get it)."" Slowly straighten the legs as much as possible and then pull the leg toward your nose. Switch sides."
